Key,PostID,UserID,Title,Description,Image
1,101,1,Introduction to MongoDB,A comprehensive guide to getting started with MongoDB.,mongo_image_01.jpg
2,102,2,How to Use Express.js,Learn the basics of building applications with Express.js.,express_image_02.jpg
3,103,3,Understanding REST APIs,Everything you need to know about REST APIs.,rest_image_03.jpg
4,104,4,JavaScript ES6 Features,Explore the new features introduced in ES6.,js_es6_image_04.jpg
5,105,5,CSS Grid Layout,A beginner’s guide to CSS Grid Layout.,css_grid_image_05.jpg
6,106,6,Building a React App,Step-by-step tutorial on building a React application.,react_image_06.jpg
7,107,7,Introduction to Python,Basics of Python programming for beginners.,python_image_07.jpg
8,108,8,Exploring Node.js,An overview of Node.js and its ecosystem.,node_image_08.jpg
9,109,9,Getting Started with Docker,Learn how to use Docker for containerization.,docker_image_09.jpg
10,110,10,SQL vs. NoSQL Databases,A comparison between SQL and NoSQL databases.,sql_nosql_image_10.jpg
